{"artifacts":[{"bytes":537,"lines":26,"mode":"0664","path":".gitignore","role":"documentation","sha256":"90bc78798042f505cd1f7ec3be25cb37453f3cf2c73eb63537416eeeabccedc2","will_execute":false},{"bytes":76035,"lines":1202,"mode":"0600","path":"admin/alquileres-admin-qa.html","role":"consumer","sha256":"2f5f7d26b0912f5f76302212445f4755e161d1f876c52d72c773eca6a1834554","will_execute":false},{"bytes":63093,"lines":1066,"mode":"0600","path":"admin/alquileres-franjas-qa.html","role":"consumer","sha256":"df389521a65aa79db6c7fc5f1138c092cb0e201bc6a1f490194a30f80edd8ae2","will_execute":false},{"bytes":4606,"lines":93,"mode":"0644","path":"docs/auditorias/AUDITORIA-CODEX-AUTORIDAD-ALQ-F1A-PRE-CONSTRUCCION-2026-08-21.md","role":"authority","sha256":"4a6d2a8462c0eeee9beb26c8fe64aca62b1a0d9aefa8e0fb782b8e49c859fe9f","will_execute":false},{"bytes":5009,"lines":106,"mode":"0600","path":"docs/auditorias/SELLO-CLOUD-ENCARGO-ALQ-F1A-2026-08-21.md","role":"authority","sha256":"d53bf9f8a5dc11d2dcab57582c18b9a26411700a9d74b79f46b9da6ada7439a0","will_execute":false},{"bytes":4943,"lines":86,"mode":"0644","path":"docs/auditorias/alq-f1a/AUDITORIA-CODEX-PRE-EJECUCION-ALQ-F1A-2026-08-21.md","role":"documentation","sha256":"37fa2355af0b185cd79eaa070ecd1b457ef17a374848c6154d32241eb5ac1917","will_execute":false},{"bytes":11163,"lines":113,"mode":"0644","path":"docs/auditorias/alq-f1a/CATALOGO-45-OPERACIONES-ALQ-F1A-2026-08-21.md","role":"documentation","sha256":"a4744aeccf9a1616bb2cb7dc48c90d8f895a8f9d56abb0824661705a8e71b35b","will_execute":false},{"bytes":3579,"lines":73,"mode":"0644","path":"docs/auditorias/alq-f1a/CONDICION-RETIRO-RPC-V1-ALQ-F1A-2026-08-21.md","role":"documentation","sha256":"a462b51ee66a401a338ef2f63e109d68d6340f2ea3eee45e77262395f2f73063","will_execute":false},{"bytes":4592,"lines":104,"mode":"0644","path":"docs/auditorias/alq-f1a/DECISION-ALCANCE-ALQ-F1A-F1B-2026-08-21.md","role":"documentation","sha256":"4f7b9da7744195ca6b3e99c6a7682dbbbe0cca2316b8c14d09db2360c132ad70","will_execute":false},{"bytes":7437,"lines":107,"mode":"0644","path":"docs/auditorias/alq-f1a/INVENTARIO-ARTEFACTOS-ALQ-F1A-2026-08-21.md","role":"documentation","sha256":"5f9ab769c0253cf537dbadbbcaf6faf89553d57c61c85527dbd5d4d6cea5e79d","will_execute":false},{"bytes":6104,"lines":87,"mode":"0644","path":"docs/auditorias/alq-f1a/INVENTARIO-EDGE-FUNCTIONS-ALQ-F1A-2026-08-21.md","role":"documentation","sha256":"1b24fcbdc102aca7ce7942b26e99c73f4828f5fc63b5ad2c85cacb63a3a08f55","will_execute":false},{"bytes":4945,"lines":88,"mode":"0644","path":"docs/auditorias/alq-f1a/MANIFIESTO-BORRADOR-ALQ-F1A-2026-08-21.md","role":"documentation","sha256":"3627840fe68975a23d517cfac3f096a1e762ab5eb8a09dc357a4d8b25fabb998","will_execute":false},{"bytes":11481,"lines":165,"mode":"0644","path":"docs/auditorias/alq-f1a/MATRIZ-PRUEBAS-ALQ-F1A-2026-08-21.md","role":"documentation","sha256":"7ecc810eb6b49faaafcf8c2c94c8af609de2d1de52bb7e561256ff5faeb72a01","will_execute":false},{"bytes":7786,"lines":111,"mode":"0644","path":"docs/auditorias/alq-f1a/MATRIZ-RLS-ALQ-F1A-2026-08-21.md","role":"documentation","sha256":"0f38cb4f97845137f5822db03115baccb75f57101ce7c2f61c830a527e635968","will_execute":false},{"bytes":4075,"lines":87,"mode":"0644","path":"docs/auditorias/alq-f1a/REESTIMACION-ALQ-F1A-2026-08-21.md","role":"documentation","sha256":"45bb8448afd2bad3298b729bb7f8ed19f6bb5293f27dc08f8456ffd3a46989c8","will_execute":false},{"bytes":7284,"lines":172,"mode":"0644","path":"docs/auditorias/alq-f1a/RUNBOOK-COMPUERTAS-ALQ-F1A-2026-08-21.md","role":"documentation","sha256":"c2018b1133cbcf06250ae6bfffbd21fa5cef1cc8f5ac33c3eb13c4d8b539ad7a","will_execute":false},{"bytes":446891,"lines":86,"mode":"0644","path":"docs/auditorias/pruebas-alq-f1a/ALQ-F1A-CONCURRENCIA-LOCAL-CASES-2026-08-21.json","role":"schema","sha256":"95973b5699f2bcbe32c2fbd71475731d089751e355602bf5620ede3305765199","will_execute":false},{"bytes":7736,"lines":17,"mode":"0644","path":"docs/auditorias/pruebas-alq-f1a/ALQ-F1A-CONCURRENCIA-QA-CASE-2026-08-21.json","role":"schema","sha256":"e2e62d22ec020639a2175e1326644750e002fbe81ce97f12ba522a33587c5cab","will_execute":false},{"bytes":10723,"lines":265,"mode":"0644","path":"docs/auditorias/pruebas-alq-f1a/ALQ-F1A-FIXTURE-PG17-SETUP-2026-08-21.py","role":"harness","sha256":"e0ca20acf81fc8a10cd5dcafa1afd89f6d23ebdb82752dcc1925de2ad8502e7c","will_execute":true},{"bytes":6347,"lines":147,"mode":"0644","path":"docs/auditorias/pruebas-alq-f1a/ALQ-F1A-FIXTURE-PG17-TEARDOWN-2026-08-21.py","role":"harness","sha256":"245f9642d1e95a801f8b47bbcbf974f0b17c865678bf2b6419fbdaf262e80c15","will_execute":true},{"bytes":7208,"lines":170,"mode":"0644","path":"docs/auditorias/pruebas-alq-f1a/ALQ-F1A-GENERAR-BUNDLE-LOCK-2026-08-21.py","role":"harness","sha256":"5c0ad3439446f237985ceba0d3a3f6ea86742cb295d9c83498d79bdb0afc9211","will_execute":true},{"bytes":12591,"lines":291,"mode":"0644","path":"docs/auditorias/pruebas-alq-f1a/ALQ-F1A-HARNESS-CONCURRENCIA-LOCAL-2026-08-21.py","role":"harness","sha256":"ae89d18f627cc016201d659efcffdf4a5b3b6155a3f4adab58c953091c73e898","will_execute":true},{"bytes":10821,"lines":224,"mode":"0644","path":"docs/auditorias/pruebas-alq-f1a/ALQ-F1A-HARNESS-CONCURRENCIA-QA-OFFLINE-2026-08-21.py","role":"harness","sha256":"d431b2e40772e7c02ecd4bc61411f478888c274e6a8f03d22fe4878faa43099b","will_execute":true},{"bytes":19344,"lines":404,"mode":"0644","path":"docs/auditorias/pruebas-alq-f1a/ALQ-F1A-HARNESS-LOCAL-2026-08-21.py","role":"harness","sha256":"d483fda11802a2afc071a829a391e23fedddc83021cb25936b8e08f9cb5a2b01","will_execute":true},{"bytes":9133,"lines":166,"mode":"0644","path":"docs/auditorias/pruebas-alq-f1a/ALQ-F1A-RUNBOOK-MCP-QA-2026-08-21.md","role":"documentation","sha256":"959d2e55617e7448588df148a407d97223106701e8fa6dcc5644790139b14c07","will_execute":false},{"bytes":3095,"lines":78,"mode":"0644","path":"docs/auditorias/pruebas-alq-f1a/ALQ-F1A-SELLAR-RUNTIME-PG17-2026-08-21.py","role":"harness","sha256":"b7aaddc5972812cc528b7a71698f1f1116eab27d182b3cba6fad70427d69db39","will_execute":true},{"bytes":9426,"lines":237,"mode":"0644","path":"docs/auditorias/pruebas-alq-f1a/ALQ-F1A-TEST-COMPATIBILIDAD-UI-OFFLINE-2026-08-21.mjs","role":"harness","sha256":"c913e6ce2f8ce209d5175b0295010c4cfa2b6359f8c69ba7112c1574c2ab98cd","will_execute":true},{"bytes":11042,"lines":251,"mode":"0644","path":"docs/auditorias/pruebas-alq-f1a/ALQ-F1A-TEST-HARNESSES-OFFLINE-2026-08-21.py","role":"harness","sha256":"0716ee50755aa64b5516c064916ca0c78cf87e62145e2fbc0ad19f834b50fd85","will_execute":true},{"bytes":10421,"lines":239,"mode":"0644","path":"docs/auditorias/pruebas-alq-f1a/ALQ-F1A-VALIDAR-RECIBO-2026-08-21.py","role":"harness","sha256":"8d353e92b11386f4a20a473f3e8efbf1375e5430279e134ffec1634a52132172","will_execute":true},{"bytes":4507,"lines":65,"mode":"0644","path":"docs/auditorias/pruebas-alq-f1a/README.md","role":"documentation","sha256":"b6547aa12c83a08c07b795d67305d67bbaec4c53cdc73ceef9b6a7cfc0325b70","will_execute":false},{"bytes":17398,"lines":387,"mode":"0644","path":"docs/auditorias/pruebas-alq-f1a/alq_f1a_common.py","role":"harness","sha256":"6c9551482d6d6cc8d769e9baa1925a5782e85535d0275459b8d4b206b2f2dadf","will_execute":true},{"bytes":1213,"lines":22,"mode":"0644","path":"docs/auditorias/pruebas-alq-f1a/schemas/alq-f1a-apply-transcript.schema.json","role":"schema","sha256":"196b003c39dd778aef100539ad97fff23b33c26eb68d329d04b80af34909447a","will_execute":false},{"bytes":2679,"lines":60,"mode":"0644","path":"docs/auditorias/pruebas-alq-f1a/schemas/alq-f1a-bundle-lock.schema.json","role":"schema","sha256":"ed0304ff72e97a7c309550e81946d1d193591a15a2467b99a4c7492f992ac3b3","will_execute":false},{"bytes":1227,"lines":29,"mode":"0644","path":"docs/auditorias/pruebas-alq-f1a/schemas/alq-f1a-concurrency-case-spec.schema.json","role":"schema","sha256":"de282a03627dc98e33b45309c94429b11eceb68d2b2baef724230b742263ea61","will_execute":false},{"bytes":1169,"lines":20,"mode":"0644","path":"docs/auditorias/pruebas-alq-f1a/schemas/alq-f1a-connector-attestation.schema.json","role":"schema","sha256":"4fbab9bdb5ce6847d4b9dbdc87908fba7cf302c9dc5d6af26a720e7d19a19d40","will_execute":false},{"bytes":1227,"lines":21,"mode":"0644","path":"docs/auditorias/pruebas-alq-f1a/schemas/alq-f1a-execution-authorization.schema.json","role":"schema","sha256":"5b9f08b93c2ee8cc332e80677c2cde6499ad882153e45c359aa5444a116540eb","will_execute":false},{"bytes":1717,"lines":36,"mode":"0644","path":"docs/auditorias/pruebas-alq-f1a/schemas/alq-f1a-publication-receipt.schema.json","role":"schema","sha256":"7dde41cd0ec63a1a12d64fa3854b3f2189532b824d1f95544b04571448193dd5","will_execute":false},{"bytes":1395,"lines":31,"mode":"0644","path":"docs/auditorias/pruebas-alq-f1a/schemas/alq-f1a-qa-concurrency-case-spec.schema.json","role":"schema","sha256":"ecea7f9fe2f89c025183ca17c20301d64bb595b019b5efece866e04b4d02bdb4","will_execute":false},{"bytes":1264,"lines":36,"mode":"0644","path":"docs/auditorias/pruebas-alq-f1a/schemas/alq-f1a-receipt-contract.schema.json","role":"schema","sha256":"65e87c405a4d4e6731e377c68c1734f487707a17666fd395478c92963d5420d2","will_execute":false},{"bytes":9844,"lines":173,"mode":"0644","path":"docs/auditorias/sql/ALQ-F1A-00-PRECHECK-READONLY-QA-2026-08-21.sql","role":"verification_sql","sha256":"6a429c49a3fe1e7a8754b5892113c9b01291a3e119f1ef0a131b543f54ae54eb","will_execute":true},{"bytes":115735,"lines":2350,"mode":"0644","path":"docs/auditorias/sql/ALQ-F1A-01-REGRESION-COMPLETA-LOCAL-2026-08-21.sql","role":"verification_sql","sha256":"23c36d55fab60cc69b28bb194625d30501f45853cb72fe0e44ffe457c4eae48d","will_execute":true},{"bytes":9126,"lines":154,"mode":"0644","path":"docs/auditorias/sql/ALQ-F1A-02-POSTCHECK-INSTALACION-READONLY-QA-2026-08-21.sql","role":"verification_sql","sha256":"7c8d7139e9464d111a750811d4870465fd0ba65bfa04232d952afa4a8bab9694","will_execute":true},{"bytes":8275,"lines":220,"mode":"0644","path":"docs/auditorias/sql/ALQ-F1A-03-CALIFICACION-VIVA-Y-CLEANUP-QA-2026-08-21.s